{
  "tx_id": "01ARZ3NDEKTSV4RRFFQ69G5FAV",
  "diff": "--- a/configuration.nix\n+++ b/configuration.nix\n",
  "test_plan": {
    "adapter": "nix",
    "steps": ["build", "test"]
  },
  "affected_resources": ["root_config"],
  "base_revision": {
    "generation": null,
    "etc_git_commit": "abc123",
    "config_digest": "sha256:0000000000000000000000000000000000000000000000000000000000000000"
  }
}
